{
  "schema_version": "1",
  "maintenance_id": "maint-0001",
  "task_id": "mcp-integration",
  "performed_at_revision": 9,
  "human_reason": "Reclaimed two unreferenced attempt payloads after reviewing the reachability proof.",
  "reachability_proof_digest": "0a0a0a0a0a0a0a0a0a0a0a0a0a0a0a0a0a0a0a0a0a0a0a0a0a0a0a0a0a0a0a0a",
  "deletions": [
    {
      "digest": "1111111111111111111111111111111111111111111111111111111111111111",
      "path": ".archflow/tasks/mcp-integration/attempts/1/payload.bin",
      "byte_count": 4096,
      "category": "unreferenced-attempt"
    },
    {
      "digest": "2222222222222222222222222222222222222222222222222222222222222222",
      "path": ".archflow/tasks/mcp-integration/attempts/2/payload.bin",
      "byte_count": 0,
      "category": "superseded-payload"
    }
  ],
  "total_bytes_deleted": 4096
}
